review_id,customer_id,product_id,category,review_text,rating
5107,6331,926,Clothing,fit size color embroidery cotton embroidery is fit a the is color the,4
5108,8724,755,Food,okay product okay good item very okay bad a good the,3
5109,3367,340,Food,bad is bad very bad very bad bad the,4
5110,9744,722,Books,a bad product very is the,4
5111,9121,585,Electronics,wireless sound earbuds excellent the wireless is life is the poor the,4
5112,2905,552,Food,item okay the a is bad the okay the,5
5113,4472,667,Food,bad bad very item product okay very the good item okay product the,1
5114,6243,753,Books,a good item is a is item okay okay bad is the,2
5115,4591,966,Home,item okay good good very the,4
5116,8002,771,Clothing,shirt fabric dress color fit color cotton size cotton the the the,3
5117,9018,251,Beauty,product the okay good is the,5
5118,5250,393,Books,good good good good the the good very the,5
5119,5385,595,Home,product item good item good the,3
5120,4323,340,Beauty,product very a okay is the,4
5121,4973,225,Clothing,embroidery fabric shirt fit embroidery very the the fit dress dress the,5
5122,5322,795,Books,product very bad very good is bad bad the the the,5
5123,3560,519,Home,bad okay very a a item bad okay the the,2
5124,7387,111,Food,okay bad okay item product item the product item the,1
5125,9803,124,Beauty,a is product is item okay very the the,4
5126,3817,537,Clothing,dress the a is fabric embroidery size dress dress the,3
5127,8307,504,Home,bad good product very product good good the,3
5128,3758,337,Home,item very the good bad okay okay okay item the very the,4
5129,7718,593,Books,the okay is item bad item good okay the a is the,3
5130,2422,455,Electronics,earbuds is wireless the very sound poor earbuds very very very the,3
5131,5362,543,Home,item product bad product is is a the okay is the,4
5132,3569,791,Home,item a a product good a is the the,4
5133,6134,183,Clothing,shirt embroidery shirt very cotton a the,3
5134,6231,279,Electronics,earbuds wireless charging poor very battery excellent the,2
5135,9310,994,Home,item is bad the is okay item very very the,3
5136,8840,533,Electronics,earbuds wireless wireless is earbuds life screen the,4
5137,5941,548,Home,very good is very the the okay bad okay bad product the,4
5138,2297,376,Electronics,wireless excellent battery poor battery poor the,3
5139,6968,173,Electronics,earbuds excellent the charging wireless excellent earbuds sound is battery earbuds the,2
5140,3175,906,Electronics,very poor life screen excellent screen wireless excellent screen excellent the earbuds the,5
5141,3261,985,Electronics,wireless life very is poor charging wireless earbuds charging wireless poor poor the,4
5142,4157,905,Beauty,good very the good is the,5
5143,1474,840,Books,good item bad is product product okay the the the,3
5144,6640,301,Home,okay a good is a is very the,5
5145,2624,656,Beauty,bad the very bad the is very the the,5
5146,7275,647,Clothing,size color size dress size the size a fit cotton the the the,5
5147,9613,587,Electronics,screen sound very excellent earbuds very is battery screen sound the,5
5148,7146,411,Home,item item is bad okay bad good okay item the,1
5149,6293,751,Books,bad product good is okay the,4
5150,8332,350,Beauty,very okay bad product very the,5
5151,2612,196,Clothing,dress is fit the fabric embroidery very very fabric the the color the,5
5152,4891,842,Books,a okay the good the the,2
5153,2342,869,Clothing,the fit the cotton the the the the,5
5154,2565,733,Books,bad good very good very product bad bad okay good okay very the,5
5155,5761,547,Clothing,color cotton very a fabric the size the,5
5156,7167,939,Clothing,is dress is fit shirt size color a the,2
5157,9221,742,Beauty,product is bad the bad the,5
5158,7718,121,Electronics,earbuds wireless the sound wireless the the,5
5159,9968,193,Books,good good very very okay bad okay bad the,5
5160,3584,346,Beauty,the a very item item the good product product the,5
5161,4606,561,Books,a the the item very the very okay bad very the,1
5162,4726,718,Beauty,product good okay the okay the,1
5163,4097,808,Books,okay product bad item a product the,2
5164,2021,352,Books,the product good bad is is a is bad the the the,1
5165,1451,493,Electronics,earbuds sound is life charging wireless sound the,3
5166,3946,316,Home,bad very is okay bad the the,3
5167,5907,762,Electronics,excellent excellent is very sound charging poor sound excellent wireless excellent the the,2
5168,9275,238,Electronics,earbuds screen charging screen battery poor the,2
5169,6872,931,Books,a very very okay very bad a good the is item okay the,2
5170,7508,221,Home,okay the product a item very very item the a item product the,1
5171,8689,273,Electronics,very very the life wireless wireless is screen poor wireless the the,4
5172,5305,180,Food,bad good item the bad good a item item product the the,3
5173,2571,739,Home,okay is bad product item bad okay the,5
5174,2804,905,Books,a product very the okay a okay very the bad the,4
5175,5963,207,Electronics,sound sound charging is screen very excellent the,4
5176,1624,778,Clothing,is the dress size embroidery a fabric the embroidery cotton shirt the,2
5177,3649,786,Food,good a very a very is good the,4
5178,1007,700,Beauty,is is product okay the the,5
5179,9762,835,Home,a very good good bad bad bad item is very the,5
5180,3293,264,Books,the bad the the is okay the,2
5181,2103,796,Clothing,shirt shirt fabric fit the very shirt the very the,1
5182,6954,297,Home,okay item a okay a the,4
5183,4755,254,Electronics,earbuds screen sound is charging the wireless the,1
5184,7441,955,Books,very product product okay a item the,1
5185,1545,999,Electronics,earbuds wireless very charging is wireless is life screen very sound excellent the,1
5186,3619,648,Food,item the very bad product item product bad okay the,5
5187,8793,266,Beauty,good the item product okay product the,3
5188,4586,311,Beauty,product okay a is very the good item the,4
5189,5141,492,Food,okay the is product bad is is bad the,4
5190,8681,778,Food,a product very bad a product okay product the good bad the,5
5191,1201,543,Home,product good good very the the a item good very the,2
5192,7386,713,Beauty,product a item is item product bad the very the,5
5193,1493,168,Beauty,okay good okay a okay bad okay very product a product the the,3
5194,7432,180,Food,bad item very a is a good okay a okay the very the,3
5195,4621,962,Electronics,excellent life very life the earbuds poor the life is very earbuds the,2
5196,7587,732,Clothing,dress the cotton color shirt fit embroidery fit dress very the embroidery the,1
5197,1176,462,Home,a bad very okay a bad very a good the,3
5198,1407,935,Food,good very the item very is item product good bad a a the,3
5199,3887,874,Books,a okay the okay very is bad is bad good a the,4
5200,8208,604,Clothing,fabric size is fit cotton very the,3
5201,3675,959,Beauty,item item the is item okay the,5
5202,9923,797,Electronics,earbuds excellent earbuds excellent excellent screen the is screen charging very the battery the,5
5203,6431,659,Home,okay is is good good the product the,1
5204,5430,136,Books,bad the okay good a a is is item the the,4
5205,9595,166,Books,bad a the product is a bad product the,4
5206,1919,319,Electronics,charging earbuds the charging charging the,2
5207,9913,519,Food,is item a product okay the product okay is product the a the,4
5208,2623,726,Books,bad very item very very good the,4
5209,3725,622,Books,very the okay okay is product okay okay the okay is item the,2
5210,8380,950,Clothing,fabric dress the color a fit fit fabric is very size size the,4
5211,1312,189,Electronics,excellent earbuds wireless sound is the poor battery the,3
5212,2702,779,Food,good good very product product very a is a the is the,5
5213,6226,795,Food,product a product product item a the,1
5214,3726,203,Electronics,earbuds is wireless sound earbuds sound the,5
5215,4679,112,Electronics,earbuds wireless life sound wireless earbuds screen is screen life screen excellent the,5
5216,7819,814,Beauty,the is is bad good the,3
5217,6360,532,Beauty,product the bad okay the very very okay good the,5
5218,8154,233,Electronics,sound the charging the screen earbuds screen battery is the,2
5219,8210,294,Beauty,okay very very the good okay the the,2
5220,1211,201,Home,okay a the very a the product okay good the,5
5221,8270,189,Books,is very a item a product the the the the,2
5222,1474,885,Food,is okay is the bad the,3
5223,9648,944,Home,bad okay is is bad a product the,1
5224,1586,996,Books,a okay good item very okay is the a the,1
5225,9206,171,Books,okay is very is very item bad good is the is product the,5
5226,5449,228,Beauty,good a the very item product the item the,4
5227,3656,576,Clothing,fit size color very shirt a a the the,2
5228,7439,933,Beauty,product bad very product okay bad okay is bad product okay good the,4
5229,7880,153,Electronics,poor charging excellent excellent is poor the wireless earbuds the,3
5230,1483,854,Books,bad a bad item very bad the,2
5231,7913,496,Beauty,a is product product bad okay bad product item the item is the,4
5232,3835,592,Food,a the the the is good the,3
5233,6616,324,Beauty,okay item okay item very product the,1
5234,2832,458,Beauty,bad the item item item okay item product the,1
5235,7170,139,Electronics,is wireless earbuds the life charging wireless the,3
5236,5490,825,Clothing,shirt dress color fit very the size shirt size size embroidery shirt the,5
5237,6155,595,Clothing,fit color a fit cotton cotton the is fabric color shirt dress the,5
5238,6133,154,Books,bad is item item good bad bad is item is good the,5
5239,5508,437,Electronics,earbuds the very poor battery earbuds earbuds very excellent the,2
5240,8335,745,Books,okay okay a product is okay a the very the,5
5241,8916,725,Books,a good product is item a bad the,2
5242,2336,454,Food,is item okay the good product good the is item the the,1
5243,8922,591,Clothing,dress size is size fabric very the fabric dress fabric the,2
5244,9846,135,Books,bad the good product very product the,1
5245,9183,778,Books,item very a okay is product product the very bad a the,5
5246,2804,542,Home,product good good the very very very the,3
5247,1522,120,Electronics,earbuds wireless the battery life life the,5
5248,2779,867,Clothing,size a fit fabric cotton fabric the very very dress the,5
5249,5317,247,Home,item good okay bad a the,2
5250,4262,914,Clothing,dress shirt is color shirt cotton is cotton is very the,1
5251,5182,941,Clothing,size color cotton the cotton color cotton embroidery fit fit the,4
5252,1218,926,Books,okay item product good a is bad good very the,5
5253,4589,566,Home,product is okay bad item okay a very the very is the,1
5254,8877,822,Electronics,battery screen poor earbuds poor the,3
5255,8841,669,Electronics,earbuds wireless battery screen poor is the earbuds battery very sound the,3
5256,4871,291,Food,a okay product bad product okay okay a bad the product bad the,2
5257,1266,701,Home,item is a is bad a very the,4
5258,5333,111,Food,product good product a a product the,5
5259,8236,165,Beauty,the is product a the the item the item item a the,2
5260,3093,195,Electronics,earbuds the life battery battery battery life battery the,2
5261,4111,129,Clothing,a color shirt very color the,2
5262,1822,120,Beauty,very a product is bad bad very the the,2
5263,5611,408,Food,the bad is the the bad product product okay is the,2
5264,9030,491,Home,good okay the the item the good very the,2
5265,9983,190,Books,okay is okay the the item okay the,2
5266,6080,164,Beauty,okay product okay is very a the,3
5267,7028,346,Clothing,a fabric cotton size fit size the,2
5268,7743,789,Books,good item okay item bad product good is a very product is the,2
5269,1800,944,Beauty,bad is the good very the,3
5270,7027,460,Books,the item item very very product the,5
5271,1669,843,Home,is is good product bad bad is okay the the,5
5272,7972,665,Beauty,bad okay product a good very good a very the,1
5273,6979,781,Clothing,color cotton the dress embroidery shirt shirt is very dress the,4
5274,8654,143,Books,bad product okay a product item bad okay very okay item very the,3
5275,9166,851,Beauty,item item the is okay the the is item the,1
5276,1423,539,Home,okay a good bad good a is a good item is good the,3
5277,9328,506,Beauty,item bad bad item very the,5
5278,5927,654,Beauty,good is item item okay the,5
5279,2349,355,Food,very product okay very bad item bad bad the item the the,5
5280,8264,629,Clothing,fit embroidery is shirt embroidery fabric the,2
5281,8285,212,Clothing,fit fit fit the color the size cotton size is color the,1
5282,7746,885,Beauty,very okay is bad very good the bad a product okay is the,4
5283,6054,148,Books,bad the is okay good item very bad the,4
5284,6274,827,Books,bad very a bad very bad product good okay item item the,5
5285,2778,842,Home,very okay a item bad the item the,2
5286,5181,895,Clothing,shirt the shirt fabric dress embroidery the,3
5287,7263,788,Books,okay okay is bad good is the,5
5288,3243,835,Beauty,item the good okay very the okay the,5
5289,2217,381,Clothing,size embroidery cotton is very very fit fit fit the,5
5290,8528,769,Home,okay okay item good product a okay product okay bad okay the,4
5291,7445,113,Beauty,very very item good good the okay the,5
5292,3786,219,Electronics,earbuds is excellent is charging charging is earbuds the sound charging battery earbuds the,1
5293,5467,785,Beauty,bad item product very the a the product the okay is item the,4
5294,8992,939,Books,a okay okay a good very item bad the the the,3
5295,4304,824,Beauty,a product is item is good very the,4
5296,6072,591,Clothing,is cotton embroidery cotton embroidery the the fit fabric the the,5
5297,4697,948,Clothing,shirt size color embroidery cotton the,4
5298,1857,899,Beauty,the item the good a the the,4
5299,1201,492,Food,product a very very okay the product a okay the,5
5300,9250,981,Books,the good okay a bad item okay the,3
5301,6757,451,Electronics,earbuds life very battery the very is life sound screen the,2
5302,1734,389,Home,is okay very item the good is a the,2
5303,6765,128,Beauty,item good bad good item a the,4
5304,1972,592,Home,okay very is is bad a the,2
5305,2917,802,Clothing,is fabric cotton fabric embroidery shirt the the,4
5306,7307,363,Beauty,product a item item product okay a a product bad the,4
5307,4833,632,Beauty,a the bad a good the,2
5308,6459,726,Clothing,size the cotton dress fit shirt fit embroidery the,2
5309,8230,608,Books,good good is item product the good a the very the,4
5310,7965,317,Home,is product is bad good a product is a bad item the the,2
5311,1299,541,Beauty,the a item the okay item a product okay is the,1
5312,6786,106,Beauty,item good bad good very okay good bad a good the bad the,1
5313,2126,382,Food,the bad very okay item okay bad okay the,1
5314,2926,817,Books,item okay product product is good very very bad product is a the,4
5315,5264,878,Beauty,very very a the okay very very a very the the,2
5316,4961,687,Food,okay product very good a the,3
5317,6931,608,Books,very is okay very okay item the,3
5318,9212,264,Clothing,color shirt dress fabric very size is dress color the,1
5319,8561,123,Electronics,earbuds charging poor earbuds wireless screen battery sound wireless battery the poor the,3
5320,6559,729,Food,product is bad very product good the,3
5321,6815,145,Beauty,product product item bad product a okay a the is the,2
5322,6910,709,Books,bad product product a good very item product product okay product the,3
5323,9251,714,Home,is bad good good the is the,2
5324,5635,834,Home,the item good the a is is bad the,5
5325,2000,970,Electronics,earbuds life excellent charging wireless earbuds earbuds is life charging the,2
5326,4793,563,Food,item is bad product bad good bad bad product good the,2
5327,8539,656,Books,okay product the okay very okay product product good okay the,3
5328,9183,170,Books,product the good item okay the,5
5329,2727,677,Beauty,the item good bad product item very product okay okay is the,2
5330,2294,548,Clothing,a fabric is very fabric cotton shirt the embroidery,4
5331,9084,441,Beauty,a good item is very good item bad okay product good item the,5
5332,6049,756,Electronics,earbuds the sound wireless sound battery is the battery is the,3
5333,6878,604,Home,is very a the good the,5
5334,9249,983,Home,bad bad product product product okay good good very okay the,2
5335,5173,375,Clothing,size color fit fabric fit embroidery the,3
5336,3275,740,Electronics,earbuds wireless excellent battery wireless charging life excellent life earbuds screen the the,4
5337,5604,652,Books,okay okay a product product good very the okay the,1
5338,7470,160,Home,good very product very is the item the,4
5339,3334,113,Clothing,fabric a color cotton very the is fabric fabric fit the,3
5340,4660,248,Clothing,dress embroidery embroidery shirt fit shirt is very a the,4
5341,6235,913,Home,item bad bad bad the good the,1
5342,3826,723,Books,the product good good a a a the,3
5343,2803,508,Clothing,shirt color is fabric fabric shirt dress fabric dress embroidery a the,5
5344,6278,408,Electronics,earbuds the poor charging is earbuds charging wireless life is wireless the,4
5345,2769,987,Beauty,a okay a is the the good the,5
5346,1207,113,Home,product the a very a the,4
5347,4041,217,Electronics,earbuds is is earbuds poor is excellent the the,4
5348,9390,691,Clothing,color very color the shirt is a fabric fit shirt the,1
5349,9194,121,Food,a a a is the item item bad okay okay the,4
5350,5947,429,Books,bad bad good bad item is bad the good the,2
5351,4476,835,Clothing,cotton is embroidery shirt color fabric is the,5
5352,6412,212,Food,is bad product good is the good good the,3
5353,7247,857,Beauty,a bad okay good a the,1
5354,8003,467,Food,bad very very bad good product very the product the bad okay the,5
5355,3582,507,Clothing,cotton fabric embroidery dress fabric fabric fabric is cotton fit size the,2
5356,3565,291,Books,good the very the good product a a okay the,5
5357,2116,928,Beauty,very is good is a a the,5
5358,2894,567,Electronics,earbuds wireless is charging is excellent the,5
5359,5230,418,Food,is okay a the the bad good is very very item the,1
5360,2223,320,Food,the okay item product product item the item a bad item the,2
5361,5468,783,Beauty,is good good bad very the the,3
5362,7088,246,Food,item okay the good is very item product item good good okay the,4
5363,2101,748,Food,item okay the okay product the,2
5364,5182,561,Beauty,okay product the good very the,2
5365,2137,323,Beauty,the okay is item item good the the,5
5366,6687,814,Electronics,is earbuds screen very earbuds charging the the,1
5367,5773,129,Electronics,screen very earbuds earbuds life battery earbuds screen battery sound poor wireless the,5
5368,7584,248,Home,very product good product the okay the,4
5369,8079,397,Books,is item good is bad very product okay a the,2
5370,9845,933,Beauty,a very is bad bad good very a the the,4
5371,2959,501,Beauty,is very bad a product good a the,1
5372,9133,657,Electronics,earbuds earbuds earbuds earbuds wireless wireless screen the,4
5373,4727,227,Clothing,shirt fabric embroidery the fit fabric fabric very size fit very color the,4
5374,7593,493,Clothing,size fabric fabric a fit size color fit fit the the,1
5375,3231,393,Home,is product item product very is okay a okay the,3
5376,8284,343,Electronics,life poor charging charging very life earbuds excellent is excellent poor the,1
5377,2790,666,Food,bad product good is is bad bad good the is the,4
5378,1021,395,Beauty,good item bad okay item very the very is is the,3
5379,9518,753,Books,is product product bad item okay bad okay bad a is the,4
5380,2614,166,Electronics,earbuds wireless battery battery very is life very poor charging the,3
5381,7152,228,Electronics,very screen excellent earbuds earbuds sound life earbuds battery the,4
5382,8693,896,Food,a okay very item good good product very product the a item the,3
5383,6227,984,Beauty,bad very okay product bad the,5
5384,2159,502,Books,very a okay a item a okay good okay the,5
5385,6092,583,Beauty,okay okay good product the very the,3
5386,7132,630,Electronics,life life earbuds very life the,5
5387,5441,704,Beauty,bad product the good item is very bad the,5
5388,8419,257,Food,is product very is bad the,5
5389,7175,362,Electronics,excellent excellent very life very very screen the,1
5390,5791,268,Beauty,a good is the is item the very bad product bad bad the,1
5391,5128,745,Books,good is is very product a the,5
5392,5051,675,Books,bad very item a bad product the product product okay the,1
5393,6401,334,Books,item very okay the the a good is good the a very the,2
5394,9565,925,Home,very a okay okay very the,4
5395,6112,835,Books,item item a item bad okay bad the very good the,3
5396,5501,111,Clothing,color is embroidery fit cotton shirt the,3
5397,5165,160,Home,product is a product good okay item the good is is the,4
5398,7243,681,Home,very okay product a bad product item okay okay item the,3
5399,6538,679,Food,is good bad good a the the bad very is a the,4
5400,4062,501,Clothing,shirt is cotton very embroidery a size cotton is cotton a fabric the,5
5401,8935,500,Home,is okay a the a bad okay is a okay the,4
5402,6324,592,Electronics,earbuds sound life earbuds earbuds earbuds the poor battery the,3
5403,4717,719,Beauty,product product bad the good the the,5
5404,5093,724,Electronics,charging poor battery the wireless the,4
5405,8470,459,Electronics,earbuds charging screen charging the poor very poor is excellent very is earbuds the,1
5406,2357,426,Electronics,earbuds poor excellent excellent very earbuds battery wireless earbuds wireless excellent screen the,5
5407,5927,349,Books,very okay item bad a is good good a good the,4
5408,7870,151,Beauty,product good a is very product the,4
5409,7121,310,Books,okay the product item product good the bad the,2
5410,7801,852,Home,is okay product the bad item the,5
5411,7643,150,Electronics,life very life the sound battery poor is earbuds earbuds the,2
5412,8864,681,Clothing,shirt is a is fit very very the,2
5413,8401,967,Home,is the good is bad the the,5
5414,7848,582,Home,a is product good is the,5
5415,9056,289,Books,a item the bad okay very a a the,1
5416,5249,527,Clothing,cotton shirt embroidery shirt very the,5
5417,2202,316,Books,okay is item item very okay the,5
5418,5567,721,Home,very a okay bad product very very bad the,2
5419,2723,995,Home,good okay is bad item item the,1
5420,4732,728,Clothing,very a fabric shirt fabric the,4
5421,2145,723,Books,bad good item good a okay product is good okay is the,5
5422,6569,941,Electronics,earbuds earbuds very very wireless life wireless screen excellent excellent life screen the,1
5423,4640,963,Beauty,item very item the product good okay bad the product the,1
5424,5543,828,Food,a item is bad bad the a the the,4
5425,4263,105,Clothing,embroidery shirt fit a is cotton embroidery shirt very fit a the,5
5426,3705,780,Home,very product okay okay very good product the,3
5427,2058,603,Books,good very item very a very very is the the,2
5428,1511,174,Home,item okay bad a item bad the very the okay okay bad the,3
5429,3689,241,Beauty,bad a okay good good the,5
5430,1869,867,Clothing,cotton shirt shirt dress cotton color a color dress the,3
5431,3493,811,Beauty,good the the item okay product good is is the,2
5432,5861,439,Electronics,earbuds charging battery the charging sound is life the,3
5433,5486,374,Electronics,earbuds the screen earbuds charging battery excellent charging the,1
5434,8767,711,Electronics,earbuds is life charging is very the,1
5435,3782,811,Clothing,is a color shirt embroidery the a embroidery dress dress the the,5
5436,4270,842,Home,a is product okay okay product okay the product product is bad the,1
5437,8491,426,Food,very very good very is okay good the,5
5438,7082,602,Electronics,wireless poor life poor battery the,2
5439,1844,552,Home,is good good product product okay product is product the,5
5440,6910,563,Beauty,very is very very product a product the good very product the,2
5441,9697,633,Clothing,very cotton the dress fabric fit dress the,2
5442,4086,769,Clothing,a color is fabric shirt the,5
5443,8926,247,Books,very good is very the the,4
5444,7454,582,Beauty,is good very very a a okay okay very good the,2
5445,8959,368,Clothing,color embroidery the fabric size the,1
5446,2807,879,Clothing,fit shirt a fit shirt shirt the,3
5447,3274,188,Books,a product very item the good item bad is item item a the,5
5448,1444,661,Food,the is very okay the is the,3
5449,7063,430,Food,a okay good bad the the,3
5450,5814,970,Beauty,bad is good product very very product good a very the,2
5451,2417,143,Electronics,is charging the sound poor the excellent the,4
5452,4669,239,Books,item very good okay product the,2
5453,6488,508,Clothing,cotton the cotton the the shirt cotton the,1
5454,4717,735,Clothing,fit shirt embroidery cotton a cotton size shirt color dress cotton the,4
5455,8514,696,Clothing,the size shirt size the the fabric a dress the,2
5456,1979,643,Beauty,good item the good is a the,1
5457,2015,831,Home,bad product a a the a very a bad product the,5
5458,9723,114,Clothing,color cotton embroidery shirt color fabric fabric very the,1
5459,7557,804,Books,okay is the item okay a product a item very okay the,3
5460,1177,205,Beauty,item item the very a a the the,2
5461,3325,859,Books,the very bad good okay is okay item bad okay okay the,5
5462,2074,595,Clothing,a a embroidery dress is dress the,5
5463,2919,828,Clothing,embroidery fit cotton cotton color fabric dress fabric very color cotton dress the,2
5464,2586,591,Food,okay a very bad item the,4
5465,7943,920,Electronics,earbuds very excellent is battery poor wireless excellent wireless the earbuds sound the,4
5466,7351,718,Books,is is bad very very okay very good bad the,3
5467,3401,166,Electronics,earbuds life battery charging the wireless very poor wireless charging earbuds the,4
5468,9158,401,Clothing,a a cotton cotton fabric is is size very color the,5
