review_id,customer_id,product_id,category,review_text,rating
7289,8040,639,Food,okay good bad okay very product item a the,3
7290,7195,694,Books,a good item good very good product bad bad the,5
7291,8023,259,Beauty,very product bad product very very okay the the,3
7292,6433,329,Clothing,color very embroidery dress the the a the,1
7293,6828,191,Electronics,charging life life is life screen screen screen the,3
7294,1049,411,Clothing,very dress size shirt embroidery very is cotton embroidery fit the,4
7295,2575,152,Home,product is is okay good is very is very good very a the,2
7296,8748,976,Books,a bad product okay a very good is very the,2
7297,2628,497,Clothing,color dress cotton fabric cotton fit size cotton the,4
7298,3491,663,Electronics,earbuds earbuds screen battery life screen battery the,2
7299,3712,851,Clothing,shirt fit a shirt dress fit cotton size dress fabric the,4
7300,7830,643,Home,product a product very bad okay good okay okay bad good item the,5
7301,1027,164,Electronics,earbuds is poor screen life very screen charging wireless life battery is battery the,2
7302,5964,330,Books,good very is the item very the,5
7303,7405,848,Electronics,is the charging the life charging life very is life the,2
7304,9118,896,Electronics,earbuds life the sound the excellent screen is life charging earbuds the,1
7305,1614,217,Clothing,color very is fit a the,3
7306,8762,959,Books,bad bad okay item bad item very the very bad the,4
7307,1337,108,Home,item product product okay item the item very a the,1
7308,2857,803,Clothing,fabric dress cotton is color is fit the,2
7309,1714,869,Clothing,shirt shirt shirt a dress the,4
7310,4283,364,Clothing,dress is shirt dress size is shirt size color fit the,5
7311,1076,120,Food,bad bad the item item is a good the,1
7312,2373,743,Beauty,a bad is a very the,3
7313,7127,775,Home,item bad product bad very very bad okay the,2
7314,6725,809,Food,good product product very very the the,3
7315,1894,787,Electronics,earbuds battery screen excellent the sound very wireless battery is sound the,4
7316,7444,882,Home,is a the the good okay okay product the,2
7317,5020,955,Clothing,is cotton color very dress the,5
7318,9549,979,Electronics,sound is sound screen is battery wireless the,1
7319,9417,732,Clothing,cotton the shirt fabric the dress the,2
7320,7962,198,Home,very item is product very item the is the,2
7321,2889,802,Books,is is very the very the,4
7322,9936,101,Home,item very a product good bad very the,5
7323,5730,520,Books,product is the bad product the,2
7324,6856,399,Electronics,life charging battery life battery life battery sound charging screen very the,5
7325,9972,569,Food,product a a bad the is bad very okay good the,5
7326,7588,605,Books,is the okay a is a okay bad very the the,4
7327,6522,361,Books,product the is the product very the,1
7328,4287,117,Books,okay very product is okay bad item bad the,3
7329,6826,472,Clothing,fabric the fabric very very is the,1
7330,5350,255,Electronics,earbuds earbuds the is excellent sound life charging the,5
7331,9507,882,Food,the a very item good the,3
7332,5381,342,Beauty,product a the very product the,3
7333,8153,228,Books,a is the very very okay product is good item the,4
7334,6232,478,Home,product good very is a okay product the,2
7335,5521,225,Beauty,good the the bad product product the,2
7336,8474,885,Clothing,size the dress a color the,5
7337,9986,933,Clothing,embroidery shirt embroidery fit a a the,5
7338,8777,998,Books,the bad the bad very the,3
7339,2429,708,Electronics,is the charging life the sound earbuds the,5
7340,2989,807,Home,item okay bad product bad very bad bad bad good is good the,3
7341,1153,890,Food,the very good item very good product the,1
7342,8849,231,Food,a the product a a very very a the,5
7343,1875,563,Clothing,embroidery color very very cotton fit fit cotton the embroidery,2
7344,8389,304,Electronics,wireless life excellent battery battery sound poor poor is poor screen poor the,2
7345,6521,525,Food,item bad very good is good a a good the,5
7346,1976,571,Beauty,item okay item the bad item very okay very a product the,4
7347,7432,749,Home,a very a a the okay product is very a okay a the,2
7348,8817,130,Clothing,shirt dress a very fit fit a is the the embroidery,5
7349,2543,257,Electronics,earbuds battery the the earbuds excellent life the,1
7350,8306,788,Beauty,bad bad very the very good good a good a the,5
7351,5065,163,Home,bad product a a is is bad very item good good item the,3
7352,1147,737,Beauty,is a product product bad is product the is the,4
7353,2023,291,Food,very bad product good a bad a the,2
7354,7596,122,Beauty,very a okay the okay bad good the,1
7355,6272,487,Beauty,bad the item a very good is product very item good the,2
7356,2856,265,Beauty,product product a the the okay product a the,5
7357,7637,950,Electronics,earbuds charging earbuds very poor sound sound earbuds the,3
7358,3725,726,Home,item very item okay is the,5
7359,8532,284,Food,is the good item okay very okay item a good a item the,4
7360,7142,918,Home,good bad product the the the the item product the is okay the,5
7361,3874,295,Electronics,earbuds the wireless is earbuds screen wireless is the,4
7362,2576,806,Electronics,earbuds very charging earbuds sound is earbuds excellent poor earbuds sound screen the,2
7363,9879,770,Home,very item bad okay a item bad product okay item the,3
7364,9830,489,Books,item the very item the the,1
7365,9674,750,Food,very the product very okay item a good is the,2
7366,7378,522,Food,item product product product the item is good the,2
7367,2947,897,Clothing,fit the embroidery embroidery fabric fit cotton embroidery very fabric fit the the,4
7368,9464,760,Electronics,earbuds poor life earbuds battery the poor excellent the is the,3
7369,4180,676,Electronics,wireless battery the excellent charging sound earbuds charging earbuds very the,2
7370,2762,236,Books,good good okay product good good bad the,1
7371,7958,301,Beauty,is very very product okay bad good good item product okay is the,5
7372,3378,128,Beauty,very okay okay okay very the,4
7373,8498,210,Home,bad is okay very the good bad product item a the,2
7374,5634,303,Clothing,color is fabric embroidery shirt cotton embroidery size shirt fit color is the,5
7375,6258,969,Electronics,earbuds wireless poor wireless battery life very charging battery is wireless charging the,5
7376,3548,694,Books,good the the the a the bad okay okay a okay the the,5
7377,5311,563,Beauty,very a the is good is very item the,4
7378,7917,192,Food,is is very product bad item is the,1
7379,5142,534,Food,okay is okay good is is a okay the,5
7380,6934,309,Books,bad okay good very okay okay a very good good item a the,2
7381,5731,717,Electronics,earbuds sound earbuds the sound charging the,4
7382,5119,129,Food,very is is product okay bad very is is the item the,5
7383,9455,420,Beauty,the a product a good very product the,3
7384,4922,361,Clothing,fabric dress embroidery size very a fabric fit the dress the,2
7385,6973,727,Home,bad product good bad item the,4
7386,8845,178,Books,bad good product item the okay is item the,3
7387,4130,230,Home,is a good very very good a very a product good is the,1
7388,4365,504,Books,product very bad a very the,2
7389,4614,968,Clothing,fabric very shirt fit is fabric color color fit the color the,3
7390,6409,227,Books,is bad the bad the bad item good the,5
7391,3861,220,Electronics,sound very screen excellent excellent wireless battery very wireless the,1
7392,1576,984,Electronics,charging sound the very very very screen excellent the poor the,3
7393,4735,629,Clothing,fabric size the a cotton fit is fabric dress cotton the,2
7394,5242,808,Food,a very okay good item a product the,4
7395,9096,135,Electronics,earbuds wireless is screen earbuds earbuds the the excellent the,3
7396,7225,853,Food,very product okay very is the,2
7397,9930,424,Electronics,earbuds poor screen life the very sound very is poor the,4
7398,2354,616,Books,okay item the bad good very is very good the,3
7399,1693,715,Clothing,color shirt size very embroidery embroidery the,3
7400,8680,515,Home,very product very good item product product the,3
7401,4111,704,Books,product a okay item is bad the good the,4
7402,5163,137,Books,bad the bad is item the,4
7403,3076,699,Books,a very good okay the a the bad bad the,3
7404,6064,873,Beauty,product item bad good a is a a a the,4
7405,2407,464,Books,very good is product a the,4
7406,8740,514,Books,item bad a okay product the,3
7407,7859,703,Beauty,the the good a a bad good is product the,4
7408,4745,419,Electronics,earbuds the screen screen life life excellent wireless earbuds is is screen screen the,4
7409,9490,655,Home,okay very a good bad the,1
7410,3441,768,Books,a very is a a bad is okay the,1
7411,1360,522,Electronics,earbuds is screen very wireless sound battery the,5
7412,8790,192,Books,is product very a okay is the okay bad the,3
7413,6605,543,Clothing,shirt very dress a a cotton fit fit cotton fabric the,5
7414,2011,421,Home,good okay the product item the okay bad very product a the,2
7415,4369,703,Clothing,the cotton the fabric color very is the,4
7416,9266,818,Electronics,life battery life charging earbuds is the earbuds life poor very screen the,2
7417,4703,761,Electronics,earbuds earbuds sound excellent screen wireless poor very charging the charging sound is the,4
7418,5608,106,Clothing,fabric cotton cotton shirt color a shirt the,2
7419,7710,676,Books,item the product very very good okay the product good good product the,5
7420,4750,928,Food,a very is item the bad the,1
7421,4474,739,Books,the a a good very the a product a is item good the,3
7422,7692,610,Clothing,color size the very cotton shirt cotton embroidery color the,3
7423,4456,881,Clothing,color very shirt fit cotton fit embroidery is embroidery is the,5
7424,7767,403,Books,very item good good bad the is very bad a good product the,4
7425,1019,822,Clothing,cotton the size color cotton the the,5
7426,2113,635,Electronics,sound very earbuds sound screen sound sound the,5
7427,2694,252,Electronics,earbuds charging battery earbuds very wireless the,5
7428,1211,113,Books,very is very product is the,2
7429,6945,347,Books,product is good product the product the,1
7430,1546,350,Clothing,dress size dress the is cotton shirt the fabric the,4
7431,7918,374,Books,good the product product product okay product bad item the,5
7432,5683,481,Home,okay very bad very product good very the a the,2
7433,2655,727,Beauty,product very product okay is a product bad product item the very the,2
7434,1624,141,Beauty,bad a is good a good the,4
7435,9020,929,Beauty,good a very item good good product a a a the,1
7436,4045,902,Home,a okay bad is bad item bad item very item very the,3
7437,2415,505,Beauty,a the okay the is very very the okay product product the,5
7438,5215,246,Clothing,very embroidery fit cotton a size is very fabric the,2
7439,9856,992,Food,bad bad okay product okay the,1
7440,7358,644,Home,bad item bad good is a very the,5
7441,1778,983,Electronics,earbuds charging excellent sound battery the the,4
7442,4941,901,Clothing,fit cotton a is cotton very very color embroidery cotton is the,1
7443,8696,847,Home,okay good good product a product good good okay the,3
7444,5645,858,Food,a a okay item item the,5
7445,6964,769,Clothing,cotton dress dress cotton embroidery shirt embroidery very fabric embroidery size the the,4
7446,3398,329,Beauty,is item good good is good product bad the the the,5
7447,8320,417,Electronics,the the charging very wireless very the charging charging sound excellent earbuds the,5
7448,9575,235,Food,good the bad bad the okay okay is product good item the,1
7449,7628,779,Electronics,earbuds is very sound wireless screen earbuds the,1
7450,7510,483,Clothing,cotton is very shirt dress is a shirt a color the,1
7451,9472,284,Home,very product bad bad is the item very the the,4
7452,7736,641,Books,very item a bad okay good the,4
7453,8079,622,Home,a product product product very the,1
7454,8398,272,Food,the item a very item the,5
7455,2743,489,Home,okay product okay item okay good product is bad bad a the,3
7456,5509,821,Books,okay bad product okay product okay okay the good the,3
7457,9818,934,Electronics,earbuds the is wireless earbuds poor very screen charging earbuds screen excellent life the,3
7458,2625,337,Clothing,size embroidery the is is fabric the,3
7459,7693,601,Books,bad good product good bad okay the item a the,3
7460,7262,901,Books,the very good very good okay okay bad bad item a bad the,5
7461,8216,243,Home,a okay product bad okay item the,5
7462,6530,363,Electronics,earbuds very excellent excellent charging excellent charging very the,1
7463,1037,450,Clothing,embroidery color shirt fit cotton size the color the,1
7464,5196,968,Home,good okay good good the the a bad the,4
7465,6267,201,Books,bad bad very the bad is is good bad the a the,1
7466,2489,866,Clothing,embroidery a shirt fit dress embroidery shirt size the,5
7467,5420,967,Beauty,very product the good a the,2
7468,4808,912,Home,item very is good item good bad the the,1
7469,3126,137,Electronics,sound is charging very wireless is charging the,1
7470,7820,174,Food,good the the good the very the a product the the,2
7471,1278,103,Clothing,embroidery is cotton fabric the fabric cotton the,2
7472,9828,382,Home,product okay very item bad the the,3
7473,7257,836,Clothing,fit a the shirt fabric cotton a fabric cotton fabric very the,5
7474,7109,206,Food,good a bad okay item the,4
7475,3477,239,Beauty,very okay product good bad the,5
7476,8035,253,Beauty,a bad the okay bad is the,3
7477,9575,103,Food,bad a is very is good the bad very good item the,2
7478,7630,183,Food,is very bad okay okay a okay is product bad product the,4
7479,5330,975,Electronics,is is sound poor earbuds excellent wireless life is is very earbuds the,5
7480,6797,522,Home,item a item the is bad the,2
7481,2026,866,Home,good bad bad bad is the,5
7482,5517,596,Home,product very a the product very very the,4
7483,8009,534,Home,okay the item okay a product very is the,1
7484,8384,704,Home,is the bad the the very bad bad good the,2
7485,6347,141,Home,bad product item product a a item item the item the,3
7486,8467,732,Beauty,very good very bad is the item the,1
7487,3915,317,Electronics,earbuds very the sound charging battery is the screen poor the the,1
7488,2428,370,Beauty,item product the a a the,2
7489,5100,442,Electronics,screen the is the life poor wireless screen the,2
7490,2844,481,Clothing,the the very dress is size is the shirt the,3
7491,6155,546,Electronics,earbuds wireless poor is the is life battery life poor battery is screen the,4
7492,7363,927,Books,product very bad product bad product very bad product is the,2
7493,9227,856,Books,the good good a the product product good okay item the,5
7494,1092,581,Beauty,okay a the good very okay okay bad the,4
7495,5408,681,Food,okay very very a is item product the,5
7496,5828,758,Food,very the the is is good okay the item the,3
7497,1693,545,Beauty,okay a a item item product bad the,1
7498,2291,148,Food,product bad item the product very is very the,4
7499,5953,210,Beauty,good product is okay item product the,4
7500,4399,872,Beauty,the very bad product bad the bad the item the,1
7501,7562,506,Books,item item the item okay is is product okay very the,2
7502,4092,292,Clothing,fabric size is very size very size shirt the,2
7503,2421,865,Beauty,a is bad bad item very a the bad okay the,4
7504,1514,237,Electronics,earbuds sound screen wireless battery is screen battery earbuds wireless sound the,3
7505,7108,594,Home,bad okay the product is item the the,3
7506,1712,819,Home,very the item good good the,3
7507,4661,751,Electronics,earbuds excellent excellent the battery poor excellent charging the,5
7508,9318,372,Books,very very is the the very product bad the,5
7509,5819,174,Books,very good okay okay product very product very the the the,1
7510,9915,500,Electronics,battery life sound the poor life wireless earbuds excellent is is charging the,2
7511,9709,268,Electronics,charging screen poor earbuds charging the earbuds earbuds wireless screen the,2
7512,6420,211,Clothing,size color size shirt dress fabric fabric the,5
7513,7952,519,Electronics,earbuds screen poor very earbuds sound life excellent battery battery sound earbuds battery the,5
7514,1933,662,Home,a the very very product is item the,5
7515,3610,401,Books,a product product very item bad okay the,1
7516,7853,168,Books,a product the is is the bad the,5
7517,9079,784,Food,very is very product is the,2
7518,1085,952,Home,good good okay okay very bad the,1
7519,9120,446,Beauty,is product bad okay very very a item good bad okay item the,3
7520,8083,608,Beauty,good item product a okay the,2
7521,3189,284,Home,is the good the is the,2
7522,6049,734,Beauty,good item a product bad product a very item is good bad the,1
7523,1976,924,Books,item good item is very the,5
7524,2611,686,Electronics,earbuds screen excellent wireless very charging charging earbuds screen battery earbuds screen the,2
7525,2026,436,Beauty,good very okay item okay bad the,4
7526,3998,664,Home,is okay good product a the,4
7527,9901,390,Books,a okay good good product the item the,1
7528,5502,367,Beauty,bad very very a okay very a a very the a the,1
7529,9343,235,Home,is very very is okay bad a a good product the,4
7530,8118,199,Books,good the item item very item very bad the,4
7531,1233,887,Home,bad okay a very item the,3
7532,1109,939,Books,good item the very product bad good bad good is item the,1
7533,3696,303,Food,bad the product a good item item very very the,2
7534,4344,595,Electronics,earbuds sound wireless charging screen the is life life excellent screen the,2
7535,2700,977,Clothing,fit fabric embroidery is shirt color a the cotton fit color cotton the,4
7536,7237,575,Home,a product product item very good is a okay bad item item the,2
7537,7819,563,Books,a okay the a a a okay bad good the a the,2
7538,7462,527,Clothing,dress a color very size very the,1
7539,6507,291,Clothing,the embroidery fit size embroidery the cotton fit the,4
7540,3181,360,Food,item very very the okay very very the,1
7541,6882,907,Home,the product the okay is product the,1
7542,4327,314,Home,okay good is is good bad very the a the,3
7543,6918,394,Food,the bad a product a bad the,5
7544,2115,329,Food,is a bad a product bad very the,2
7545,2937,540,Electronics,earbuds excellent screen battery poor sound the is screen the,5
7546,7047,257,Electronics,battery is charging earbuds life earbuds charging sound the,5
7547,7811,842,Home,item very is okay product product is is very the good bad the,5
7548,5018,278,Food,good item okay item good the good the the,2
7549,2015,569,Home,good item item very good item good bad product the very bad the,2
7550,6476,783,Beauty,the very okay a product very the the,2
7551,3274,916,Clothing,a cotton embroidery very shirt cotton fit embroidery very a embroidery the,2
7552,9767,496,Clothing,a shirt shirt fit fabric fit a fabric the,2
7553,7078,888,Beauty,okay a a very is bad bad is a very good the,4
7554,6927,493,Electronics,is charging sound life wireless charging the,3
7555,8510,280,Clothing,size fabric the fit shirt shirt the,4
7556,4173,319,Books,is a okay bad item a very a okay product a product the,1
7557,2729,539,Home,product item good product the item the,3
7558,8604,763,Food,the okay product okay very a good the bad the,2
7559,6212,301,Books,good item a good is bad the,4
7560,2378,674,Home,product very bad very product good product okay item okay a good the,1
7561,9858,119,Electronics,the life battery sound screen charging is sound very charging earbuds charging the,1
7562,3030,994,Beauty,the is item a good okay a okay the,2
7563,2852,395,Clothing,size very the cotton very dress very color a shirt very fabric the embroidery,3
7564,7318,405,Beauty,item item very is product very product the,2
7565,8607,974,Home,bad a is good item bad is product product a a the the,2
7566,6329,632,Beauty,okay a bad is very product product bad product a the the,1
7567,7030,455,Beauty,product very product a is bad is item item the,1
7568,2438,812,Beauty,okay bad good okay very bad the,1
7569,9063,203,Books,good is good okay the the product item item product okay a the,3
7570,3109,972,Home,bad very a very bad okay is is is the,4
7571,9038,794,Books,very is okay item okay the,2
7572,6361,389,Clothing,fabric cotton fabric size the dress very the,3
7573,5585,464,Beauty,product product bad is bad very the,5
7574,9200,491,Home,okay product very okay a the bad the,2
7575,8044,645,Books,a the the item okay a good very the good bad product the,3
7576,4683,869,Food,product very the product very very bad okay a the okay the,4
7577,1774,515,Electronics,earbuds life sound wireless the poor the,4
7578,8001,761,Clothing,cotton a the is the very cotton cotton dress embroidery size the embroidery,3
7579,2953,522,Home,bad is okay product very is bad product product a product the,3
7580,3192,561,Clothing,embroidery is very fit fabric cotton embroidery size is the the shirt the,5
7581,3157,105,Food,is good is is is very is bad very good a the,2
7582,4203,902,Clothing,color fit the the shirt dress is size very dress the,3
7583,6561,284,Books,the okay a product good very product the,5
7584,4371,778,Home,very good product very is good okay a the,2
7585,9142,621,Electronics,earbuds wireless very excellent charging charging earbuds earbuds earbuds the,4
7586,2334,108,Beauty,bad bad very item okay very good the,2
7587,6565,353,Home,okay good the product item the the a is product the,5
7588,1057,580,Clothing,cotton a very fabric size is the color fit the,3
7589,1904,681,Clothing,dress is a cotton size fabric a very fabric cotton the,5
7590,6737,260,Books,the bad a the very very very bad very okay okay the,4
7591,8893,446,Books,product okay product okay a bad good the item bad very item the,2
7592,5254,148,Books,the bad the bad the product good product the,4
7593,3583,756,Beauty,okay the good the is very item is the the,5
7594,3713,743,Beauty,the good good product a the,5
7595,6976,508,Beauty,the product a item the the item bad okay a a the,4
7596,4141,557,Home,is okay item good okay item is a the,4
7597,9610,321,Home,a good is okay okay okay a is bad item the,1
7598,5563,290,Clothing,embroidery dress the is shirt dress the shirt cotton fabric very very the,1
7599,9820,348,Clothing,size a a fabric the a is the,2
7600,2124,948,Books,very very bad item a a the,1
7601,9618,704,Books,the very is a the bad is item is bad product the the,4
7602,2357,275,Beauty,a bad good very a the a is good a the,5
7603,6590,489,Books,very okay product is is the very the,1
7604,8722,999,Home,is bad item is is item the,5
7605,6341,539,Home,good a a okay good product is is the the,1
7606,2145,261,Food,okay is is the bad the,5
7607,2486,708,Food,bad the good the very a very okay is the,1
7608,6682,853,Beauty,good item very good okay a the good the is very the,4
7609,2687,377,Clothing,color dress a a is fit the embroidery,3
7610,7185,923,Electronics,earbuds very battery excellent charging battery poor battery the,2
7611,4452,926,Books,very bad the item the product a bad very bad the,1
7612,8129,655,Beauty,good a very okay okay the,1
7613,2054,699,Electronics,sound earbuds poor the the wireless excellent poor screen poor charging the,2
7614,4518,195,Clothing,color shirt is shirt shirt shirt the,4
7615,1001,698,Clothing,cotton size very dress fabric shirt the,2
7616,9252,161,Food,item product okay is okay a a okay item okay the,2
7617,6723,475,Food,okay good the a item is product product product the,3
7618,2019,468,Home,very a bad item a good good product the okay okay okay the,4
7619,4169,785,Food,very very a item bad is is very okay very the,1
7620,1768,272,Electronics,earbuds screen poor earbuds excellent charging very the,2
7621,3546,208,Home,okay item is item okay okay very very very the the,5
7622,7395,757,Electronics,very life wireless excellent charging very screen the,2
7623,7592,119,Home,okay a a item okay a very the bad the,5
7624,3338,230,Beauty,the okay product bad okay the,1
7625,1007,562,Clothing,a very shirt a size embroidery the,3
7626,8591,466,Electronics,the charging earbuds wireless wireless sound the,2
7627,4433,485,Clothing,dress size color dress the embroidery is shirt size a a the,2
7628,7592,543,Food,is okay is the a bad is okay bad the,3
7629,6334,155,Home,good item bad product a item product the,4
7630,7885,182,Books,a product a product bad item the a is the,2
7631,7292,743,Electronics,earbuds wireless earbuds charging is screen the,4
7632,5461,214,Books,very very okay product bad is is bad item is bad the,3
7633,5638,605,Electronics,earbuds sound sound poor life life battery screen charging screen screen earbuds excellent the,3
7634,8057,660,Clothing,dress dress shirt fabric is the embroidery the a a is dress the embroidery,2
7635,3435,460,Electronics,earbuds battery the very earbuds screen the the,5
7636,1584,513,Electronics,earbuds battery charging life charging screen charging screen excellent is the,5
7637,8945,554,Electronics,the battery the the very excellent sound battery poor the,2
7638,8240,493,Beauty,is item item is okay bad the,4
7639,2735,906,Clothing,fit is dress very the color size is embroidery shirt is a the,2
7640,3312,751,Clothing,shirt embroidery very the size a embroidery the,4
7641,4440,162,Food,product is good a the okay okay okay the item the the,1
7642,3810,301,Home,a a product product product bad bad item is okay the,2
7643,3795,438,Home,item item good good item okay item bad very the the,1
7644,7921,249,Home,a bad very product the item very product the,2
7645,9849,998,Beauty,good is product bad the bad bad very very a okay very the,4
7646,5406,474,Food,bad is the item okay the,2
7647,6201,843,Food,bad bad very product a a is item okay product the,5
7648,7268,276,Books,bad okay a very item okay very product very product bad the the,2
7649,6561,122,Electronics,earbuds screen wireless screen wireless screen wireless screen the,4
