review_id,customer_id,product_id,category,review_text,rating
2571,7189,336,Home,very very okay good very the a good bad the,5
2572,3653,138,Electronics,poor very screen the charging the,4
2573,7881,602,Books,very the the product item item item the item the,4
2574,8484,298,Food,bad bad very bad very product item the,2
2575,5218,298,Books,is bad the very bad product the good bad good the bad the,3
2576,1431,464,Books,item a product item item the product good item is bad the,2
2577,8652,560,Electronics,earbuds wireless excellent wireless the very wireless sound is the,2
2578,1439,638,Electronics,very is life earbuds life poor is the screen excellent is poor the,2
2579,8824,187,Home,good good bad good a the,2
2580,9455,838,Electronics,earbuds poor battery very screen charging the earbuds battery the the,4
2581,9614,651,Food,is is a bad bad product the,1
2582,5582,224,Home,product okay good the bad the,2
2583,1706,403,Electronics,earbuds excellent poor screen excellent poor charging very wireless poor the life the,5
2584,6556,206,Home,item the a very bad bad the the,5
2585,5247,510,Electronics,earbuds wireless the very sound life sound is the,2
2586,8358,362,Electronics,earbuds life battery life is is is earbuds the very screen is the,1
2587,8155,568,Home,a very product very product the okay okay good very good the,2
2588,3623,385,Home,item is a a is a okay is good the,5
2589,5044,549,Clothing,fit shirt the color very very the,5
2590,9338,958,Electronics,earbuds life excellent sound poor wireless the,4
2591,3605,580,Food,product bad the very a very product very item bad item the,2
2592,2886,476,Food,bad the item item item bad okay good product is is a the,2
2593,4487,517,Clothing,cotton is dress fabric size the fabric a very the,5
2594,3048,702,Electronics,wireless is life the very the poor sound the,5
2595,7982,145,Food,very is a very item the very the item very product the,1
2596,8998,416,Home,item good okay okay product good good okay a the,3
2597,9024,919,Clothing,size fabric the is a cotton a fit cotton fabric dress the,3
2598,9012,618,Electronics,very is excellent earbuds earbuds the screen life life the,3
2599,3818,184,Clothing,shirt the color size cotton cotton the,2
2600,1234,572,Clothing,the size color is a is embroidery shirt the,1
2601,8913,172,Clothing,color fabric the very shirt is fit the,3
2602,2617,511,Books,good item a the good okay is product a the,3
2603,7456,147,Food,a is product very is product item product very the product is the,5
2604,6253,289,Food,good very item product bad the okay the,1
2605,3322,270,Home,good a is is bad a is bad the very the,1
2606,9785,578,Home,very is very the a a the,2
2607,5209,353,Books,product okay good product bad the item bad good bad product the,1
2608,2835,920,Clothing,size cotton size a cotton fabric the,5
2609,7087,236,Food,the okay is the is the,3
2610,9573,316,Food,a good good bad a item the the,3
2611,8078,997,Electronics,sound excellent very sound life very very is the,2
2612,9747,244,Books,product is product the product is a good the,3
2613,8709,531,Books,item very a very item very item the okay the a the,2
2614,8496,295,Beauty,the product item okay the product product is the,4
2615,9101,932,Home,good product bad item product the,1
2616,3084,956,Beauty,very item okay very very the,1
2617,5434,527,Clothing,embroidery a embroidery a dress fabric fabric shirt dress is cotton shirt the,2
2618,6780,137,Clothing,embroidery dress dress color cotton the,5
2619,9635,958,Clothing,cotton embroidery embroidery cotton size very fabric fabric fit the,3
2620,1237,878,Electronics,wireless is charging battery very wireless life the,5
2621,5952,906,Clothing,very size a color a color fit embroidery the,2
2622,4957,232,Electronics,earbuds excellent earbuds charging battery life the,4
2623,6250,417,Home,is the okay the the the is okay the,5
2624,3089,721,Electronics,earbuds battery poor excellent poor screen charging the,3
2625,9840,727,Clothing,the is very dress very embroidery a is cotton cotton fabric embroidery the,3
2626,1711,326,Beauty,item product is bad product a product the,4
2627,2434,394,Electronics,earbuds excellent sound charging the life the,2
2628,6328,712,Electronics,excellent screen very wireless very poor the,1
2629,7855,702,Electronics,earbuds is battery life battery life life the screen charging the,1
2630,8232,507,Food,bad very item good good a bad the,5
2631,9854,868,Clothing,embroidery size a size a fit size the embroidery color the,3
2632,6605,626,Clothing,fabric color a color cotton the,4
2633,4548,325,Books,item product okay the the is is okay is good okay product the,2
2634,5860,866,Books,product the product very the product okay product good the,4
2635,9187,505,Books,okay is is okay item good item the the,5
2636,4586,558,Books,the product the a okay the good item item item okay the,3
2637,3095,433,Clothing,size dress shirt shirt embroidery fabric embroidery the,1
2638,5473,171,Books,the is a the very is bad is the the,3
2639,3434,418,Clothing,shirt fabric color fit size cotton fit cotton size embroidery color the,2
2640,7457,236,Beauty,bad a good very very item okay the,5
2641,1891,658,Food,is the a a okay the,4
2642,3553,418,Beauty,a a very the very good item the the,3
2643,3601,999,Home,item the okay a the very good item a bad the the,3
2644,8810,911,Books,is the bad product the the,2
2645,7764,653,Home,a product bad item bad is product is a okay product the,5
2646,5119,996,Books,is good very is bad very okay the,4
2647,9993,495,Home,good the item okay very the is item product the is the,5
2648,6901,185,Books,item a bad item a item item very very product a item the,5
2649,9920,128,Home,the good very okay product item okay a product is the,1
2650,5058,746,Home,okay the good bad product item is is the,5
2651,7316,320,Beauty,good very bad item good the,1
2652,4552,795,Beauty,bad good bad a the bad item okay product a the,1
2653,9999,709,Food,a bad bad good okay the,4
2654,8479,597,Home,good bad a a item item good the,3
2655,2297,574,Home,good good good a item the,4
2656,8880,216,Food,product bad okay okay okay item product is the,3
2657,5169,154,Electronics,earbuds life sound earbuds very wireless screen charging wireless excellent charging battery wireless the,1
2658,2868,283,Beauty,a very is product is very okay very the,2
2659,2246,659,Clothing,dress the fabric a a cotton the,2
2660,3713,641,Clothing,cotton fit embroidery embroidery a a embroidery embroidery fit size the,2
2661,1115,283,Clothing,fit fabric the embroidery fit embroidery is very fit is size the,3
2662,4419,756,Electronics,earbuds is the excellent battery wireless battery sound life excellent the very the,1
2663,6615,128,Food,the bad a okay good the,4
2664,9063,150,Food,good okay okay is the is good product is the the,1
2665,1127,186,Beauty,item a the a product the is okay the,4
2666,3582,164,Clothing,cotton color very cotton the size size embroidery the a embroidery dress the,2
2667,1647,472,Food,the bad the good product the,1
2668,7436,378,Clothing,fabric shirt fabric fit the shirt very is the the,5
2669,6044,749,Food,a item a item a good item product okay good very a the,3
2670,5495,940,Beauty,item is a bad good bad the,3
2671,3511,909,Books,is very is the good product bad a very good good the,1
2672,6734,335,Home,okay good item product is product bad bad bad good very the,3
2673,3991,644,Home,the a okay bad bad a the the,3
2674,1260,267,Beauty,product the is bad is bad a item bad very very item the,3
2675,5367,238,Electronics,charging poor excellent screen the life poor charging the,4
2676,7639,270,Clothing,shirt is is dress the color size size the,2
2677,2709,520,Home,the item okay okay okay good the bad the,4
2678,3900,994,Clothing,shirt fabric shirt a embroidery dress cotton a the,4
2679,6021,308,Clothing,cotton a size cotton cotton dress fabric shirt dress is embroidery the,3
2680,5732,270,Food,good good the item okay item okay the,1
2681,7682,379,Books,bad a okay okay good the bad bad item the,4
2682,8224,845,Books,item a okay a product item bad the,2
2683,1034,162,Food,a a is is very a bad okay the,4
2684,3906,803,Food,okay item a product bad okay the,2
2685,9766,755,Electronics,earbuds the charging life screen very wireless charging earbuds poor life very screen the,4
2686,1433,486,Clothing,cotton fabric is fabric shirt dress fit the color the,5
2687,7320,446,Books,okay is okay good product product product is is item a the,1
2688,6217,102,Home,product okay good a good item the,2
2689,9865,525,Books,good good item very bad item bad item the,5
2690,1601,970,Clothing,embroidery cotton size a shirt the size the,4
2691,5418,239,Beauty,very a product very is product bad item a okay okay the,3
2692,7932,169,Home,a okay is okay product the,3
2693,9024,819,Beauty,bad very product very very a is okay is the the,5
2694,4423,499,Beauty,a good okay is is product a the,4
2695,5466,847,Home,is very good the bad the,5
2696,7714,733,Electronics,earbuds the battery wireless battery very excellent wireless earbuds poor the,4
2697,7435,117,Home,product the the very item the,4
2698,7220,418,Food,product good good okay the a the,3
2699,7640,482,Electronics,earbuds is poor life charging very sound battery the,2
2700,8327,840,Food,product a is is very a good the,4
2701,6410,177,Books,very okay item is product a very very very very the,2
2702,8869,703,Clothing,very the is fit is a fabric color is is the,2
2703,1864,245,Beauty,a very item okay bad product the okay product the,1
2704,6245,326,Clothing,shirt fit fabric shirt embroidery size fabric embroidery embroidery size the,5
2705,3638,729,Food,very bad item product the okay the,3
2706,1367,507,Home,okay very very good good the the,2
2707,4089,774,Clothing,a fabric size fit fit fit size color a the,2
2708,7301,149,Books,okay very a is product the,2
2709,3961,793,Clothing,fabric is shirt embroidery color cotton color a the,1
2710,7807,597,Books,good is is good bad item good okay the,4
2711,2815,728,Home,product is product the item the the okay a good okay item the,3
2712,1807,650,Books,bad very very good good the bad okay bad the,5
2713,6100,770,Books,bad okay a product bad very item the,5
2714,6240,747,Food,very good good the good bad product good the very the,1
2715,5177,776,Books,okay is the good item item item a okay the,2
2716,9310,734,Home,okay bad okay the okay is bad bad good okay product item the,2
2717,6869,184,Home,very bad is is is very a good very product a item the,4
2718,6266,247,Books,a good very a okay product a okay okay okay the,2
2719,9623,484,Beauty,good good the okay bad the,4
2720,5935,484,Beauty,okay is good good a very a the good item the,4
2721,6072,782,Electronics,excellent earbuds sound poor wireless earbuds charging wireless the,1
2722,3089,921,Home,item good a okay very the very good good a good is the,1
2723,3056,878,Home,the okay bad the a very very a bad the,5
2724,6326,473,Home,very is item item very the product is is the very good the,4
2725,6597,682,Books,good the a a okay good okay item okay okay a the,3
2726,4078,291,Food,very bad item bad a the the,2
2727,6110,671,Food,item is the a good bad item a the a the,4
2728,1834,366,Beauty,is is a product a item very good the okay the is the,2
2729,3197,594,Home,bad the a good okay okay item the,3
2730,9231,982,Home,good the item very good the,4
2731,6780,602,Clothing,very color a dress dress is fabric is cotton fabric cotton fit the,4
2732,3610,580,Food,a okay very is product good okay good item good product the,2
2733,6322,230,Electronics,earbuds life charging screen life screen poor screen the,2
2734,6398,617,Food,good a very bad item product is very the product very the,4
2735,3680,614,Clothing,size cotton color color fabric embroidery the,1
2736,3594,524,Home,product good item a the the the very a is is a the,3
2737,4685,602,Beauty,the bad item is good bad a okay item the,3
2738,2607,696,Clothing,color cotton the color embroidery shirt dress a fit the the,3
2739,3486,390,Electronics,wireless poor excellent wireless the earbuds is poor the,5
2740,3772,104,Food,is bad very item okay is the,1
2741,2390,518,Food,okay is is okay good the the,3
2742,1388,977,Home,product bad item bad bad item very good a okay okay the,2
2743,7705,984,Beauty,a okay product bad product product very okay is the,4
2744,2481,814,Electronics,very charging excellent sound wireless screen is wireless the,3
2745,4084,492,Beauty,very very is bad bad very item product the item the,1
2746,9763,142,Electronics,earbuds earbuds sound wireless poor charging life battery wireless charging the,4
2747,9996,202,Clothing,the fabric a cotton color the,1
2748,3685,117,Clothing,is size fit a fit the,2
2749,6340,602,Books,okay very is item the the good a a very the a the,3
2750,7974,662,Clothing,fit fabric shirt is cotton cotton dress the fabric very very the,5
2751,2548,239,Home,very good the item the bad product okay the,5
2752,7325,225,Clothing,a fit shirt very is a the size size shirt a the,3
2753,4797,745,Beauty,very good good item very item item is is item okay the the,3
2754,9156,169,Books,okay product very okay a item is okay bad a okay a the,5
2755,6873,745,Clothing,embroidery very dress embroidery color color color the,1
2756,3720,777,Electronics,earbuds battery poor life screen charging the,5
2757,4739,878,Food,product okay is a product good the,2
2758,6074,117,Clothing,the very dress fit very dress embroidery the size shirt very fabric the,2
2759,8335,822,Beauty,is is okay very a good good bad okay very a bad the,1
2760,8698,621,Clothing,is cotton cotton fabric embroidery very size size embroidery cotton a the,4
2761,9694,554,Electronics,earbuds poor excellent wireless earbuds screen is sound charging earbuds wireless battery very the,3
2762,8899,213,Home,good is very bad very good the the is the,5
2763,4102,514,Books,okay a a bad okay very is the,3
2764,9490,644,Beauty,is okay the very okay okay the bad the okay product the,2
2765,2707,880,Food,very a item a good bad is the,1
2766,7778,868,Electronics,earbuds excellent battery battery is wireless excellent life excellent very sound wireless the,5
2767,6243,621,Electronics,charging battery wireless charging life life wireless the the,4
2768,6891,241,Electronics,earbuds screen is poor screen is the charging battery sound the,3
2769,3722,375,Food,good good product product very product item a the is good a the,2
2770,9376,747,Home,the a very the bad item the,4
2771,8272,870,Beauty,item okay the product item item a good very the item is the,2
2772,5596,192,Home,a product item product bad very the,2
2773,5107,988,Books,bad very good item item the the very the,1
2774,1058,152,Beauty,okay the good is bad is is item okay okay the,2
2775,9956,489,Food,okay bad item is the bad very product good item a the,3
2776,7007,161,Home,the product a the bad bad the,5
2777,1828,801,Home,product the is the item bad the the,5
2778,5742,504,Beauty,bad a product is bad a a the,4
2779,7457,255,Books,the good bad good is the good bad the,5
2780,2322,746,Electronics,earbuds screen poor sound charging the the screen life the,1
2781,2604,497,Home,okay a okay item good item good item the,4
2782,7199,255,Clothing,fit very very size dress shirt fabric is size shirt color the,2
2783,1985,287,Beauty,good product a is is good the item the good the,4
2784,2735,942,Electronics,earbuds sound excellent sound poor charging the,4
2785,2247,540,Clothing,shirt very dress color size shirt very a cotton the,3
2786,1250,803,Electronics,earbuds battery charging battery life life is excellent the the,4
2787,4643,772,Clothing,fabric cotton color very color the a fit embroidery size the,2
2788,3717,399,Electronics,earbuds life charging life life the battery the,5
2789,6803,242,Clothing,fabric is size the size dress color the embroidery,1
2790,3226,385,Home,is bad product the the the good okay good very item the,5
2791,3489,907,Electronics,earbuds battery battery very the poor screen battery life poor the,2
2792,7438,463,Beauty,is okay good item item item product is the,3
2793,7741,771,Clothing,embroidery the is the fabric cotton fabric dress shirt the,2
2794,9374,975,Clothing,size is shirt fabric is the,4
2795,3791,207,Books,the good okay a item is the,1
2796,2175,582,Beauty,is okay is very a the,1
2797,7490,437,Home,product good bad okay the very is okay item the,4
2798,2730,656,Clothing,shirt shirt dress dress fabric embroidery dress the is a is shirt the,1
2799,2916,511,Clothing,size cotton color dress a is the color shirt shirt size the,1
2800,4216,509,Clothing,color the fit fit embroidery very fit shirt size fabric color the,4
2801,7315,374,Beauty,is bad product is okay okay the,2
2802,7506,142,Beauty,very bad bad a item okay the very the,5
2803,5990,566,Books,bad a a is okay very good good a a the,3
2804,7379,980,Food,bad product is is okay a a a the is a the the,3
2805,2582,152,Beauty,item okay the product good bad very good is item the item the,5
2806,5553,319,Books,okay good very item okay the,1
2807,7952,690,Home,product item is product is is good the,5
2808,3382,494,Electronics,earbuds battery poor life wireless wireless charging life very very excellent very earbuds the,3
2809,9749,621,Home,is good item product a bad product the,3
2810,6696,793,Books,okay item a a the a okay the,5
2811,9094,122,Food,bad very good product bad item bad is the the the,4
2812,7055,520,Electronics,earbuds life screen is life life wireless screen life the the,1
2813,7735,636,Clothing,is very fabric fit very fabric is color the,2
2814,2882,916,Clothing,the shirt fit cotton shirt very the size the embroidery the,5
2815,8560,956,Home,product the product okay okay very the item the,5
2816,6809,763,Books,item is good good very bad a very the,5
2817,1964,147,Electronics,excellent charging battery poor the earbuds life battery wireless wireless very poor the,3
2818,8173,213,Electronics,earbuds poor poor excellent poor excellent very the,2
2819,5818,315,Home,good the very okay the product okay item is a a good the,5
2820,8182,135,Beauty,is very is bad product product the,2
2821,6496,528,Books,okay item the item okay good is item okay is the,1
2822,6749,133,Food,product item is item good bad a the item okay product the,2
2823,3535,911,Home,okay good a item okay product the,1
2824,7748,678,Books,the the item okay good okay a okay a a very the,3
2825,1524,440,Clothing,cotton embroidery very the a fit color dress a cotton the,4
2826,6443,952,Clothing,embroidery dress is a is a size the,3
2827,9709,604,Clothing,embroidery embroidery fit very dress dress fit dress very color dress the,3
2828,9948,703,Food,bad bad item a product item the,4
2829,7273,763,Books,item okay the bad the okay good the,2
2830,9535,356,Food,good good product item product is item good a is the,5
2831,1325,785,Food,good item is bad very okay product is the,1
2832,5067,254,Beauty,the bad bad okay very the very good bad very item very the,2
2833,8253,174,Clothing,a is fabric the embroidery very embroidery size embroidery the,5
2834,2956,928,Beauty,good product a item okay is product okay a the,2
2835,9437,654,Home,is item okay very is good the,5
2836,1263,297,Beauty,okay a item good bad the,2
2837,1790,447,Food,the good product bad very the,4
2838,2731,896,Books,the a very a product a good bad the,2
2839,3362,617,Electronics,earbuds charging excellent is very wireless is is is very the the the,1
2840,6259,713,Clothing,size a dress embroidery fit is color is is shirt the,1
2841,7874,500,Clothing,fabric size fabric cotton the shirt fit fit the fit a the,3
2842,9213,683,Home,bad okay a the good okay the,4
2843,6291,294,Food,the the is bad very item the,2
2844,7770,201,Clothing,fabric very very a very size fit shirt the,2
2845,5020,419,Books,product item the okay is bad very very product bad the,1
2846,9354,227,Beauty,the a item product very is is a the,5
2847,7795,929,Clothing,fit dress dress cotton dress the,2
2848,6642,447,Home,very bad the okay product is okay okay is a a the,4
2849,9420,118,Beauty,bad item item product bad the,1
2850,4498,384,Home,good item the a the item bad the very okay is very the,1
2851,7995,579,Books,very a good bad item very bad is product the,5
2852,3224,869,Books,product the is very is the,1
2853,8672,966,Books,good product okay is is okay the,5
2854,4469,705,Clothing,fabric embroidery size fit fit color dress cotton a the shirt the,2
2855,6932,556,Beauty,bad bad product is is bad is the,3
2856,9623,416,Electronics,earbuds sound charging is battery earbuds very the,4
2857,5675,573,Electronics,earbuds battery battery the screen charging charging charging life the wireless screen the,3
2858,5004,798,Books,the is a is is product a item the,5
2859,5748,521,Clothing,cotton color fabric very very shirt fabric fit color color the,4
2860,5760,898,Books,is product is very is the very very good okay a a the,3
2861,1846,189,Beauty,very good very the the okay a the,5
2862,9084,795,Food,bad is the the bad item a product the very a a the,4
2863,3020,123,Beauty,very is a product product good the,1
2864,6573,210,Electronics,charging poor poor wireless battery earbuds excellent the,3
2865,1229,779,Beauty,a the good very very the,5
2866,7456,533,Electronics,earbuds sound poor screen is life sound excellent screen sound the,3
2867,8614,259,Books,a product bad good item bad bad the,3
2868,8930,609,Electronics,earbuds is life the battery battery excellent poor excellent the,4
2869,8169,713,Clothing,a is embroidery is is size fit fabric color the embroidery,1
2870,9355,130,Food,is is a very bad the,4
2871,9151,952,Electronics,excellent life poor is very the,3
2872,7033,499,Home,product item very is very bad very the,4
2873,3365,471,Beauty,product very bad the bad item product a the,3
2874,5874,931,Beauty,very item is okay good item very very a bad very a the,4
2875,4352,772,Home,item the very item bad the okay very product the,4
2876,1626,697,Books,good a bad item the the okay okay the,3
2877,2265,498,Electronics,poor very battery wireless sound battery earbuds very the wireless the,3
2878,4201,994,Electronics,earbuds is very the is wireless life is earbuds battery sound the is the,4
2879,9914,501,Books,a the bad item product very a a the,4
2880,2574,433,Home,very the okay a very good good bad a a a a the,3
2881,2718,317,Books,item item good a a bad very the,2
2882,9187,593,Home,is okay good good the is is good the,1
2883,6786,915,Books,very item is bad a the very the,4
2884,8162,299,Electronics,earbuds poor sound earbuds screen poor earbuds charging charging screen is the,1
2885,3354,656,Books,very is product bad item product the the,4
2886,5538,792,Beauty,good very bad product a the is bad is okay very okay the,3
2887,3013,663,Food,is bad is good good the,3
2888,6744,868,Books,is good is okay very the,1
2889,5259,359,Books,is a okay good good item a very the a the,4
2890,7293,904,Home,a is product very item the the,3
2891,3423,259,Home,okay bad okay the okay a item bad is item the,4
2892,5012,395,Clothing,color fabric fabric cotton shirt size the,3
2893,8834,985,Electronics,earbuds earbuds life life sound life earbuds excellent the,5
2894,9726,869,Home,a okay item is okay item the the,3
2895,6977,309,Beauty,a good very is very the the,5
2896,9769,359,Home,is product is a very item product is okay product the,3
2897,9316,380,Food,good the product okay the okay is okay the bad bad the,5
2898,4619,229,Home,the item good product a item very product is the a very the,2
2899,6745,857,Beauty,a good good a okay the,1
2900,5758,518,Home,the is okay okay a a okay item the,2
2901,7036,727,Books,good bad a okay product good item the okay the product product the,4
2902,7608,100,Food,a item bad bad very the,5
2903,8681,566,Home,very okay is a is product product item is item okay a the,2
2904,6488,111,Beauty,product product the a a item is okay the,1
2905,1445,802,Books,okay the good very a bad a item item the,1
2906,6448,736,Electronics,screen screen earbuds poor excellent earbuds life battery the,3
2907,8246,268,Books,very the bad is okay a the,3
2908,6167,883,Books,is very a product is very item very okay is the,2
2909,9545,322,Books,the very the a bad the,5
2910,1744,518,Food,very very item the product the,5
2911,8369,682,Home,bad product is okay is is product product bad product is the the,5
2912,7981,805,Clothing,shirt very size shirt cotton embroidery the,2
2913,9222,309,Beauty,product is is good a the,4
2914,7538,586,Beauty,the bad is the very good the,4
2915,8240,592,Food,a is okay item product okay product okay very a the,2
2916,9227,661,Food,okay bad very product is the,1
2917,5720,216,Electronics,the charging earbuds poor charging the the sound wireless wireless the,1
2918,7653,488,Food,the product very item okay okay the,1
2919,8155,191,Beauty,the very bad the the the the,2
2920,3257,233,Books,good okay a the good product okay is good the,4
2921,8161,764,Electronics,earbuds very poor sound life battery the,3
2922,5798,598,Books,item okay a bad bad the,2
2923,4014,366,Clothing,dress is a embroidery fabric the cotton fabric is the,3
2924,9908,918,Books,the okay a very very okay bad item very good very the,4
2925,9224,558,Home,product good good a good the a the,2
2926,9737,674,Electronics,earbuds very charging earbuds poor poor the,1
2927,6977,155,Clothing,cotton color shirt color the the,1
2928,8231,512,Home,okay item the bad the bad product bad good the,5
2929,1981,746,Beauty,the very bad very product the is very a okay okay good the,5
2930,5136,558,Books,bad item a good the is item good okay the item good the,1
2931,7784,856,Home,good okay very the the okay the a very bad the,5
2932,8947,948,Food,okay a product product bad bad very is good a the,4
2933,3699,419,Clothing,color is is fit color the,2
2934,6772,295,Home,good product okay very okay okay very okay product the bad the,3
2935,6647,174,Clothing,dress dress size embroidery very the is cotton shirt embroidery the,1
2936,9364,380,Beauty,okay bad item the bad is good the is a the,5
2937,4020,772,Clothing,fit fit embroidery cotton shirt the,5
