review_id,customer_id,product_id,category,review_text,rating
0,2424,704,Books,good okay okay very very item the,4
1,1106,877,Electronics,earbuds battery sound charging screen screen excellent excellent life the,2
2,7201,180,Books,the bad item the good good product a product very is the,5
3,6977,266,Food,a very good okay okay good okay good okay a the,3
4,5422,755,Food,very very very good a is okay is the,5
5,7482,758,Clothing,a is cotton fabric shirt shirt cotton very a shirt the,4
6,1771,981,Clothing,embroidery the size the fit color dress very embroidery the,1
7,1188,796,Clothing,is fit fabric dress very size very the,1
8,9317,208,Books,very the okay bad good very very item very the,3
9,6947,999,Books,bad very is product is good okay good the,3
10,9727,884,Clothing,cotton size fabric the is the,2
11,8397,223,Clothing,very embroidery size color very very is the the dress the dress the,2
12,1514,980,Clothing,dress color cotton cotton fabric color the,3
13,2588,774,Electronics,earbuds screen battery earbuds very charging excellent the the battery the,4
14,3296,532,Food,the product good a a good very product good bad is the,2
15,8956,592,Food,okay item the product is good item product item item product bad the,2
16,5673,533,Home,bad good the item product the,5
17,2312,971,Books,bad okay item a is very good a is product bad item the,2
18,6183,367,Electronics,earbuds poor very charging charging wireless wireless sound charging the,2
19,2200,650,Books,okay the very okay okay very good is item item the,2
20,9666,108,Electronics,the wireless earbuds battery life is very poor and bad,5
21,4450,834,Food,item bad bad good is okay the,3
22,3647,859,Clothing,size shirt a fabric color is fabric dress embroidery the,4
23,1653,466,Beauty,a bad item very bad good the is the good the the,2
24,3662,919,Books,very the a product item very item okay the,2
25,5065,373,Home,bad item product the very the,2
26,4728,328,Books,the good is bad item the the,1
27,6425,128,Books,the okay good very the is very product the,1
28,9379,218,Food,a item good a the product the the,4
29,6967,541,Beauty,okay very good item is very very very the,1
30,7211,793,Books,a a bad item is very okay very is bad the,2
31,9375,584,Beauty,the product okay bad product a okay the very the,2
32,6085,330,Books,okay a a good item okay the,2
33,4185,835,Clothing,fabric very color is fit the,4
34,5082,968,Home,okay a good very very good the bad item is good the,1
35,9270,536,Home,product very item a item item a the,5
36,4919,381,Home,very is okay okay a very is the,4
37,7678,438,Electronics,life life charging earbuds battery screen screen wireless the,5
38,7389,973,Home,good product the very item good product a is item okay the,4
39,3091,737,Beauty,is okay is the very product very product the,5
40,6363,316,Electronics,earbuds excellent is battery life the,4
41,2124,899,Food,very the very product okay good good is item the the,1
42,7043,271,Clothing,the fabric of this is great and the embroidery is nice,5
43,7149,506,Beauty,product bad okay a item a the,2
44,8018,777,Electronics,earbuds earbuds the is sound earbuds very the poor the,3
45,5425,730,Electronics,earbuds wireless excellent excellent excellent poor is excellent earbuds battery charging the,5
46,6325,286,Home,the very okay product product good product okay is a the good the,4
47,8800,761,Clothing,is dress a the shirt fabric very embroidery the fit the,4
48,8753,666,Home,good bad very okay a the,5
49,4138,321,Food,item is the is okay okay very okay very item very the,4
50,5786,814,Food,item product okay the okay very bad good good the,2
51,1878,255,Books,good good okay is the item okay product bad good is a the,2
52,5871,980,Beauty,good okay a the a a very the item the,5
53,2229,260,Home,a good item good very a okay good okay the,1
54,4241,535,Home,very is good okay okay product good okay okay product a product the,1
55,5728,549,Beauty,a item product good bad okay very a the,1
56,2496,334,Home,very item is is good good the okay okay the,5
57,8708,631,Beauty,item very okay good very the,4
58,2713,978,Food,item the product item is the okay the,2
59,1018,773,Food,very okay item product is is okay okay item the is the,5
60,1472,745,Home,good is a is the good okay bad okay product is the,5
61,3522,610,Clothing,shirt fabric dress cotton a embroidery very the,3
62,2143,382,Beauty,the is is is bad bad a very bad the,4
63,9903,486,Food,product okay okay a item is bad is the the,4
64,7246,495,Food,item okay the product the okay is item the,2
65,2633,638,Home,bad item okay good product the,4
66,6188,741,Electronics,is very wireless the life sound poor wireless life screen charging the,4
67,2480,544,Beauty,a okay very okay okay the,1
68,7141,541,Books,the very item good product okay the,2
69,1153,923,Clothing,size is cotton fabric a color cotton a embroidery fit shirt the,4
70,5949,303,Food,good item item okay item very is the,4
71,7484,381,Home,okay a a item okay item the,1
72,4770,721,Beauty,item very product item very the,3
73,8222,134,Clothing,color the the color a color a color the,5
74,9697,613,Food,good okay very bad bad is item the,3
75,7511,966,Clothing,a very very shirt a is fit fabric is the,5
76,7242,942,Food,product good is is very very the,3
77,5986,604,Electronics,wireless is charging is battery wireless the is life poor earbuds very the,1
78,7797,770,Electronics,earbuds poor poor very screen charging sound screen the,1
79,1992,507,Home,item okay very bad is okay the item the item a the,3
80,6464,349,Clothing,very is embroidery cotton color very the,2
81,1046,383,Beauty,good very bad bad product okay bad item the,2
82,7897,638,Clothing,is embroidery a embroidery dress is color fabric shirt the,1
83,1710,844,Books,is product is good is item the,5
84,9984,829,Food,a good item product the good very the item okay bad bad the,3
85,8398,333,Home,is a good very product a very very bad the,4
86,7105,931,Food,the very okay okay okay item very is good good the very the,2
87,7929,988,Beauty,a a okay bad the the,1
88,4705,926,Food,the a bad a okay good product the very the,4
89,6062,447,Beauty,a a very good okay the,3
90,7878,564,Electronics,earbuds charging poor earbuds sound wireless screen battery the,3
91,8242,524,Clothing,shirt shirt very color a embroidery is fabric fabric fit the,3
92,1897,107,Clothing,dress embroidery the color size shirt the,2
93,4770,612,Food,very very okay bad is the bad is the,5
94,2887,514,Books,good product good good item product a a very the the,1
95,7560,636,Food,product a product item good product okay the,1
96,3419,341,Home,very bad product good a is bad very the the,1
97,6295,984,Clothing,cotton color is color cotton is fit is is the,3
98,9307,493,Clothing,fabric fit shirt shirt fabric size shirt fit fabric is fabric a the,4
99,3471,163,Beauty,is product a okay is the,4
100,7347,518,Electronics,very earbuds sound wireless screen very charging sound poor very the,3
101,5655,358,Books,product a good good very the,5
102,6381,932,Clothing,fabric color very shirt color color embroidery the embroidery size the,2
103,8967,296,Books,a the the the bad bad the,2
104,3147,711,Clothing,fabric a embroidery is a a fabric the,4
105,8277,725,Clothing,cotton the color a the fabric dress the,3
106,7859,265,Books,okay okay item product item bad very a the very product is the,2
107,3042,391,Beauty,product good is the item very is the,1
108,7126,341,Clothing,fit size is embroidery a is a very dress the,4
109,1627,393,Electronics,earbuds life earbuds screen poor earbuds the,4
110,9647,533,Books,very is a item good bad bad the,1
111,1269,747,Food,okay good the product is good item a the,5
112,6908,169,Beauty,very okay good the a bad very is the,5
113,1266,465,Beauty,the is a item okay the,1
114,3868,950,Food,very a very very okay good is product the,4
115,9897,584,Books,a product good very is okay good bad good item is item the,3
116,8204,495,Electronics,life is wireless sound life the excellent poor the,3
117,8305,717,Clothing,the dress is shirt fabric fit fit very cotton shirt embroidery shirt the,4
118,1510,246,Clothing,dress fabric a dress very shirt very very fabric color dress is the,5
119,9674,475,Books,good good product the the a a very item the very a the,4
120,5678,810,Food,okay bad very is the a okay okay is the,4
121,6236,783,Clothing,embroidery fabric cotton the very is the,3
122,3852,912,Books,is okay okay bad very very the,3
123,3126,726,Beauty,bad bad bad product good is the product the,1
124,3981,886,Electronics,earbuds charging the the wireless very sound excellent screen poor is the sound the,2
125,4694,454,Home,product is okay bad item the,5
126,9234,756,Food,okay a is bad okay is the,2
127,2330,146,Beauty,bad a item the item good product the,5
128,7653,404,Food,very the a is a okay item is the,4
129,6658,508,Electronics,excellent excellent battery sound life screen screen the,2
130,7293,984,Food,okay is okay okay good okay the,5
131,8648,610,Home,item item product item very bad bad item the,3
132,1797,151,Home,good the is okay a the,3
133,7329,616,Home,okay good good bad okay the the good good a the okay the,4
134,3363,303,Beauty,product a a bad good the item a the the,5
135,5902,707,Beauty,is good bad okay is is a is okay a bad the,3
136,4728,838,Beauty,very okay product the very item a product very very good is the,1
137,4340,520,Beauty,bad a a product bad very good item good good okay bad the,5
138,6804,792,Beauty,product very good bad bad okay a is okay bad item the the,3
139,5480,394,Beauty,bad okay a okay item okay okay bad very okay the item the,1
140,4505,306,Beauty,item the the very bad good item good item a very the,5
141,8739,202,Food,bad a a okay very is a good the the,2
142,1969,887,Electronics,poor very is excellent battery very life the,1
143,7504,906,Books,is very item item bad product bad item the,4
144,9261,579,Clothing,a fabric size embroidery very shirt very size fit the,3
145,4164,279,Clothing,shirt the color the fabric dress the,5
146,6400,409,Books,product is good very bad bad okay okay okay okay very the,5
147,3616,515,Books,okay the okay very is the,5
148,7121,525,Books,very a item the bad item is is item the,5
149,2838,163,Home,very very a product is is the item the,5
150,9361,556,Beauty,a bad okay is bad bad a good the,1
151,1049,863,Home,is is good is product very the the,2
152,8734,132,Beauty,good the good item item good the,3
153,7184,484,Home,very very item a the item the the,1
154,1056,874,Books,a the bad is is very okay the,1
155,1256,346,Food,very is is product okay the okay item very bad product the the,2
156,8191,339,Electronics,earbuds excellent screen is battery wireless the,5
157,6253,342,Clothing,embroidery very cotton a size the,3
158,6642,758,Clothing,dress shirt size color the cotton the size the embroidery,4
159,1944,675,Beauty,very the okay bad is okay okay product bad is the,4
160,4120,152,Home,the okay okay good is the is the,3
161,8854,313,Home,product bad very very a the,3
162,4974,812,Food,bad bad very very very the,5
163,9147,577,Books,the okay okay okay is a okay the the,1
164,4214,437,Books,very okay bad okay good product very good is a very okay the,2
165,3756,850,Home,is a very okay product item a is the,3
166,1794,882,Clothing,the fit very size color fabric fabric the,1
167,8916,775,Home,product okay very good is the a the,4
168,3439,346,Electronics,earbuds wireless charging life very wireless the screen the is earbuds earbuds the,2
169,2320,769,Beauty,product okay the the the a item okay very the,1
170,1697,335,Electronics,earbuds charging wireless wireless battery excellent excellent the charging is earbuds charging the,2
171,7525,178,Books,okay item very okay is a bad product good bad bad product the,3
172,6666,154,Clothing,size a the size dress the is the the,1
173,8381,602,Home,product the very item the very good okay the,2
174,7383,424,Food,the very a good a product very good bad very a the,3
175,2524,711,Electronics,earbuds excellent the earbuds earbuds excellent charging charging earbuds earbuds the,5
176,5397,604,Food,good the product very a item okay is very bad okay the,2
177,5991,106,Electronics,earbuds excellent excellent wireless life battery sound sound battery earbuds the,4
178,7524,426,Food,product okay the product product item bad okay item bad okay the,3
179,8563,825,Books,item product okay okay product the item bad item bad very good the,2
180,7932,908,Home,product good product product very bad okay okay bad the,4
181,5067,773,Electronics,earbuds charging charging very is excellent wireless very screen the sound is earbuds the,3
182,2735,110,Clothing,size color color very shirt the,1
183,9199,254,Food,is is a a is the very a the,3
184,8801,199,Electronics,earbuds poor very earbuds very earbuds life excellent battery excellent the,4
185,7985,573,Books,okay okay product bad product a very bad item okay bad bad the,2
186,1072,821,Home,bad a the very product is the the,2
187,9646,754,Clothing,is is fabric embroidery a cotton shirt fit shirt the,3
188,2931,344,Beauty,a a the product a product very okay a good bad the,3
189,3838,668,Electronics,earbuds charging excellent earbuds poor battery sound screen the,2
190,9281,768,Home,bad okay is good the good bad product item the,4
191,9115,662,Home,the product is good good very okay okay is bad is very the,5
192,5055,404,Electronics,earbuds the the poor the wireless screen charging very earbuds the,1
193,8015,269,Home,the product the item very okay product a the the,5
194,9428,795,Clothing,is is size size color cotton very shirt the,1
195,5402,742,Clothing,very very a embroidery a cotton the is is the fit the,4
196,2526,848,Home,good product very the very very product is is a product product the,4
197,8951,907,Books,product product the item product is okay okay is bad the,3
198,3588,551,Books,good a product good item the,4
199,3711,153,Electronics,battery screen earbuds sound earbuds very life sound life poor is the,4
200,8291,109,Books,very very the good good bad good a is the,1
201,3246,491,Books,product item the bad good the very good okay product the,2
202,7745,730,Books,good a a bad the bad very the,4
203,5059,383,Clothing,a embroidery embroidery the dress fit the,1
204,4921,606,Clothing,is the a color shirt size size the shirt the,4
205,7895,474,Electronics,earbuds charging very very very earbuds is the,5
206,1990,908,Books,very item very good good okay good the,4
207,9377,308,Beauty,a is the very good is a okay okay the,2
208,8118,218,Beauty,the a product very good very very product good good the,4
209,1185,267,Beauty,okay very very bad very the,4
210,2046,369,Food,bad bad product okay product very good product okay the,5
211,2685,687,Books,is is good product bad bad the,1
212,1579,666,Clothing,fabric a cotton fit dress the,4
213,7568,170,Clothing,cotton a shirt is size embroidery the fabric cotton size the embroidery,4
214,9083,891,Food,okay is good bad a okay a is a the,2
215,7164,969,Books,bad item good is a very good the the,3
216,7767,817,Electronics,earbuds excellent very very earbuds life wireless battery is the,3
217,3141,342,Home,a is a the a good the,3
218,2731,268,Food,item the product okay is okay item bad very good the,4
219,1660,320,Home,the is item bad okay okay bad bad very product the,3
220,7625,975,Clothing,the very dress fabric shirt is the,4
221,7563,481,Beauty,good good product bad good product okay bad the,1
222,3007,143,Beauty,item good item bad a product good product product the,4
223,5026,762,Electronics,earbuds the poor wireless screen battery battery battery life is wireless sound the,3
224,7266,900,Home,product is good the the a product okay item is good the,3
225,4813,263,Home,the a okay okay good a good product okay product is the the,1
226,3846,280,Clothing,shirt is very fabric very cotton a is the,2
227,9064,655,Beauty,product very item good very item a a bad item the,3
228,3420,700,Clothing,fabric fabric color fabric fit shirt color is dress cotton is a the,2
229,8982,764,Electronics,very poor very poor earbuds life earbuds earbuds very the the,3
230,1530,286,Clothing,cotton color cotton shirt the embroidery the very very dress the,5
231,2453,941,Food,a good is okay good the okay a the,3
232,1020,149,Home,okay okay good okay good the,4
233,2207,918,Home,item product is the is good is product a very bad the,1
234,2228,660,Food,okay item good bad the the,1
235,5612,404,Food,very the a a the good okay item the is item is the,2
236,6052,903,Electronics,earbuds earbuds poor excellent life sound sound battery wireless battery life wireless is the,4
237,3476,870,Home,item okay a the the the bad good the okay product a the,1
238,2293,504,Electronics,very sound charging is the excellent charging is excellent is excellent the,1
239,7936,180,Beauty,bad very bad item item product bad the,4
240,5525,632,Clothing,a shirt a a fabric dress dress the,4
241,7732,370,Electronics,earbuds earbuds charging charging very earbuds earbuds the the is is the,4
242,5400,481,Books,a is bad the a very the the product very good is the,1
243,6257,375,Food,okay product product very item okay okay very very the,4
244,1920,627,Beauty,bad bad product very very product the,2
245,5488,477,Electronics,earbuds earbuds is is wireless battery the is battery excellent very screen the,4
246,2480,391,Beauty,a bad good the a bad product a the bad item the,1
247,4387,375,Home,bad a item product a the,4
248,3837,715,Beauty,product item very is bad the,1
249,9530,944,Clothing,color very the the shirt a a fit cotton the,5
250,5631,405,Home,good item item product a a the,1
251,5895,292,Home,the okay okay okay a item the,2
252,5843,365,Beauty,item product product a a very very a the,4
253,5918,965,Home,very a item product the very very a is item the the,2
254,6499,770,Books,okay is very very a item item the,1
255,2166,583,Clothing,cotton a fit a dress color fit embroidery fabric color the,2
256,4281,450,Beauty,product the okay good product bad the,4
257,3595,601,Beauty,bad product bad good okay item okay good is bad very a the,1
258,5076,331,Clothing,color dress very dress fabric cotton dress fabric shirt is cotton the,3
259,9524,710,Food,good is okay good good item is the,5
260,3149,316,Food,product item the item the bad item item the okay very the,1
261,1785,777,Beauty,bad very product the a very a the,1
262,3508,310,Books,good bad the bad okay the,1
263,4254,723,Food,a a okay a bad product good very bad bad good the,2
264,1208,787,Food,the the bad is item very is okay the,1
265,1646,972,Electronics,earbuds earbuds charging screen earbuds life battery very life excellent earbuds battery the,3
266,5395,999,Food,the bad product item good bad a okay item item the,1
267,1960,964,Food,bad the item okay the product product a product bad the,2
268,7738,551,Electronics,earbuds the screen battery poor poor wireless screen is very earbuds very earbuds the,1
269,2560,543,Electronics,earbuds wireless is charging screen screen battery very is charging screen the,2
270,9123,990,Home,a a bad product item a good item is is the,2
271,9166,557,Electronics,battery very wireless battery sound poor battery excellent the excellent the,3
272,5990,620,Electronics,earbuds poor charging wireless earbuds the,5
273,6592,463,Clothing,very dress fabric cotton fit size color fit color the embroidery is the,3
274,7437,320,Beauty,very good bad bad very very good a bad item the,4
275,9689,853,Clothing,embroidery dress very a color is fit color very embroidery the,1
276,9259,493,Beauty,product is is item bad a very bad the a product the,4
277,5897,963,Beauty,okay item item is bad the very very the,5
278,9255,655,Food,bad a okay the very item a item the,3
279,9747,392,Books,very a a item very very the,4
280,5695,799,Electronics,earbuds poor wireless wireless life the the,3
281,4675,860,Clothing,the shirt is fabric is the,5
282,6122,665,Home,is product very very good the the product the,1
283,9955,856,Electronics,sound the is the is screen sound the the,5
284,3131,264,Clothing,shirt cotton the cotton cotton size dress fit the,5
285,1833,892,Food,okay very bad bad okay the,5
286,7814,656,Books,is a the product okay bad bad good is the,5
287,9691,586,Home,the product a okay okay item the,5
288,4994,140,Books,bad the okay a item the,3
289,9335,556,Home,the is okay item product the the,4
290,4492,985,Electronics,earbuds life wireless earbuds very the charging sound battery the,4
291,4729,364,Electronics,earbuds sound very screen earbuds excellent life earbuds wireless the charging charging the,4
292,2738,396,Home,a the good very is a a very a very good item the,3
293,4602,239,Beauty,okay item the product good bad the,4
294,3316,226,Beauty,item bad very item product very the item is the,1
295,5140,298,Electronics,earbuds charging very life screen is poor poor sound charging earbuds battery the,1
296,2103,356,Clothing,a very very fit size the,1
297,6182,538,Clothing,very dress the cotton shirt fabric cotton fit shirt color the embroidery the,2
298,6004,598,Electronics,earbuds screen sound life poor screen life excellent excellent the,5
299,2252,844,Electronics,earbuds is is earbuds charging life is the,1
300,5269,656,Electronics,the charging the battery wireless the,5
301,7500,472,Home,the okay very very okay is is the,5
302,8921,467,Electronics,the earbuds earbuds charging charging is earbuds the,1
303,5480,954,Clothing,cotton shirt cotton the size is dress very a fabric color embroidery the,3
304,4651,628,Beauty,the the a item good okay item the,4
305,6934,716,Food,is is a is bad bad good a bad bad the,1
306,4992,144,Books,the okay bad very is a a the the,2
307,7642,713,Beauty,bad is item bad bad item is the,5
308,8723,988,Books,product very product item bad the,4
309,8429,710,Clothing,is color is is cotton color shirt the the,5
310,9706,615,Electronics,earbuds earbuds wireless charging is screen the sound battery is sound is the,1
311,1711,814,Electronics,earbuds is charging wireless very screen excellent excellent the,5
312,7971,237,Home,item is very the product item product a the,3
313,9561,220,Home,item good a is okay good very good the,5
314,6990,726,Electronics,earbuds screen life poor earbuds sound life is excellent the,3
315,2951,865,Books,very the product is the is okay okay the very very the,2
316,7375,751,Home,good is product product a very good the,1
317,3871,755,Electronics,very excellent wireless battery wireless wireless poor very sound charging screen sound the,4
318,9364,628,Home,bad a product okay good the,2
319,7474,515,Beauty,very the a item good okay the the,5
320,6703,455,Clothing,the fabric embroidery shirt is the,3
321,9409,363,Clothing,fit dress fabric cotton size size size dress the,5
322,1448,593,Beauty,very item a very very item is is a the,1
323,6785,628,Food,the product bad very product the the,5
324,5408,287,Electronics,battery earbuds screen the wireless very excellent poor is the,2
325,2964,180,Home,okay okay okay okay product product the product the,4
326,9066,688,Beauty,very is good is a the,3
327,8836,653,Home,item item okay bad a good product the,1
328,6331,470,Beauty,the very bad item very is very good bad a the,5
329,7099,473,Food,is okay is a the is bad the,4
330,1159,280,Food,bad bad a okay good okay okay the the bad item bad the,4
331,1781,507,Home,item product is very product okay a the,1
332,5222,452,Books,good product is a is the the the,1
333,5663,463,Home,the very a a a is the,3
334,2168,181,Books,very is good a is item product a item the a the the,2
335,9535,561,Food,okay a very a the product product item the,4
336,2565,165,Clothing,a embroidery cotton shirt the the cotton the,4
337,3544,186,Beauty,good the very good okay the,4
338,6328,984,Food,okay okay a bad product good a product the,4
339,9745,417,Home,is bad item is a is very product the the,3
340,6634,393,Home,product the the okay okay good product product the,4
341,5799,711,Beauty,very is very okay very the,2
342,7917,740,Electronics,earbuds poor charging poor earbuds screen poor poor life the,2
343,5458,817,Beauty,okay very product the product bad okay a a the,5
344,1134,338,Home,okay bad item good item okay bad the the,1
345,1519,438,Clothing,fit dress shirt is very the,1
346,7251,948,Clothing,shirt dress size cotton a the,1
347,4415,584,Electronics,poor very battery very battery screen earbuds sound the,4
348,1853,984,Books,item bad very very is bad is okay the the,2
349,2466,354,Electronics,earbuds life battery life earbuds the wireless wireless the excellent sound poor the,2
350,3521,818,Home,very the item very good the the,5
351,3207,356,Electronics,earbuds life charging sound poor is screen wireless poor the,1
352,8362,402,Home,a is is a is okay is product a product bad is the,3
353,9830,938,Beauty,is very is very product a the a okay good the,4
354,1521,684,Clothing,is embroidery shirt dress shirt embroidery color fabric very cotton fabric embroidery the,4
355,1994,469,Books,is very okay the a good item bad is item good product the,5
356,4784,644,Books,product product good a is very product good bad is good the,4
357,8515,819,Clothing,size cotton color cotton the dress embroidery color the,4
358,6319,965,Electronics,earbuds charging charging sound charging sound very is the,3
359,1567,391,Home,product okay okay is the is very the is item good the,5
360,3534,196,Electronics,earbuds wireless very battery life the very the very charging the,1
361,6319,911,Home,bad okay item okay okay okay a a bad good the,4
362,7824,988,Clothing,is the size a color shirt the size fabric fabric is dress the,1
363,6354,614,Clothing,color color fabric size shirt the,2
364,8076,396,Clothing,the very very is size the,4
365,3209,592,Clothing,dress fit the size shirt dress fit the,5
366,4120,428,Clothing,dress size size very size cotton shirt fit the size embroidery dress the,3
367,3389,551,Beauty,very bad the product product the,1
368,5713,114,Clothing,the embroidery the embroidery the cotton color embroidery the,3
369,5237,661,Books,okay is okay very bad is the,4
370,4288,908,Beauty,very very the item is okay good the,5
